acronym,name,major,college,prerequisite_text,enrollment_cnt,A_cnt,A_percentage,cardinality
ENGL 110T,Old English Literature in Translation,English - ENGL,letters_and_science,Writing 2 or upper-division standing.,,,,110
MUS 94,Freshman Audition,Music - MUS,letters_and_science,"",,,,94
ART 14,Lower-Division Print,Art - ART,letters_and_science,"",588,416,0.7074829931972789,14
ARTHI 187W,Coming Home: The House Museum as Cultural Encounter,Art History - ARTHI,letters_and_science,Upper-division standing.,69,44,0.6376811594202898,187
LATIN 138,Horace,Latin - LATIN,letters_and_science,Latin 102.,,,,138
COMM 1,Introduction to Communication,Communication - COMM,letters_and_science,"",14103,2949,0.20910444586258242,1
EARTH 98,Readings in Geological Sciences,Earth Science - EARTH,letters_and_science,Consent of instructor.,,,,98
ECON 194DG,Dean's Investment Group,Economics - ECON,letters_and_science,Upper-division standing; consent of instructor.,102,102,1,194
GREEK 199,Independent Studies In Greek.,Greek - GREEK,letters_and_science,Consent of instructor and department chair; upper-division standing; completion of 2 upper-division courses in Greek.,,,,199
HIST 8,Introduction to History of Latin America,History - HIST,letters_and_science,"",4437,1266,0.28532792427315756,8
ITAL 99RA,Independent Research,Italian - ITAL,letters_and_science,Italian 3 or equivalent with a grade of a minimum grade of B.,,,,99
JAPAN 99RA,Independent Research Assistance in Japanese,Japanese - JAPAN,letters_and_science,minimum 3.0 cumulative GPA,,,,99
JAPAN 198,Readings in Japanese,Japanese - JAPAN,letters_and_science,Upper-division standing; completion of 2 upper-division courses in Japaneseconsent of instructor.,,,,198
LAIS 199,Independent Studies,Latin American and Iberian Studies - LAIS,letters_and_science,Upper-division standing; completion of 2 upper-division courses in LAIS.,,,,199
MCDB 194CE,C. Elegans Development and Behavior,"Molecular, Cellular & Develop. Biology - MCDB",letters_and_science,Upper-division standing and consent of instructor.,,,,194
MCDB 194RF,Plant Development Genetics,"Molecular, Cellular & Develop. Biology - MCDB",letters_and_science,Upper-division standing and consent of instructor.,,,,194
MUS 28D,Intermediate Tuba,Music - MUS,letters_and_science,By audition. Consent of instructor and department.,,,,28
MUS 32E,Secondary Piano,Music - MUS,letters_and_science,Placement by audition.,,,,32
MUS 35B,Piano Accompanying,Music - MUS,letters_and_science,"Music 33 (may be taken concurrently); or, piano and accompanying emphasis majors only; and, consent of instructor.",,,,35
MUS 197B,Senior Composition Portfolio and Recital,Music - MUS,letters_and_science,"Passing of junior composition portfolio; and, consent of instructor; open tsenior BM Composition emphasis majors only.",,,,197
MUS A 52,Violin Ensemble,Music Performance Laboratories - MUS A,letters_and_science,"",,,,52
MUS A 152,Violin Ensemble,Music Performance Laboratories - MUS A,letters_and_science,Enrollment by audition. Upper-division students only.,,,,152
PHIL 192,Internship in Philosophy,Philosophy - PHIL,letters_and_science,Upper-division standing in philosophy; consent of department and instructor,,,,192
PHIL 197P,Senior Project for Majors with Ethics and Public Policy Emphasis,Philosophy - PHIL,letters_and_science,Upper-division standing in philosophy; consent of department.,,,,197
PHIL 199RA,Independent Research Assistant,Philosophy - PHIL,letters_and_science,Upper-division standing.,,,,199
PHIL 3,Critical Thinking,Philosophy - PHIL,letters_and_science,"",9762,4810,0.49272690022536364,3
MUS 97,Sophomore Audition,Music - MUS,letters_and_science,Passing of freshman audition (may be waived for transfer students) and consent of instructor.,,,,97
PHYS 199RA,Independent Research Assistance,Physics - PHYS,letters_and_science,Consent of instructor; upper-division standing; completion of 2 upper-division courses in physics.,,,,199
PORT 195,Senior Honors Independent Research,Portuguese - PORT,letters_and_science,Admission to the Portuguese senior honors program.,,,,195
RG ST 99PL,Persian Language Independent Study,Religious Studies - RG ST,letters_and_science,Minimum 3.0 cumulative GPA.,,,,99
RENST 199,Independent Studies in the Renaissance,Renaissance Studies - RENST,letters_and_science,Upper-division standing; completion of 2 upper-division courses in Renaissance Studies.,,,,199
SLAV 197,Senior Thesis in Russian,Slavic - SLAV,letters_and_science,Senior standing; consent of instructor.,,,,197
PSTAT 99,Independent Studies in Statistics,Statistics & Applied Probability - PSTAT,letters_and_science,"",,,,99
THTR 193H,Senior Honors Project,Theater - THTR,letters_and_science,Senior standing.,,,,193
THTR 193HB,Senior Honors Project,Theater - THTR,letters_and_science,Theater 193HA.,,,,193
THTR 2C,Performance in Global Contexts: EUROPE,Theater - THTR,letters_and_science,"",1417,699,0.49329569513055754,2
ANTH 190,Cultural Anthropology Internship,Anthropology - ANTH,letters_and_science,Consent of instructor.,,,,190
CHEM CS 11C,CCS General Chemistry,Chemistry (Creative Studies) - CHEM CS,creative_studies,"Consent of instructor for non-majors. CHEM 1B or CHEM 2B, or a Pass with a minimum of 3.0 units earned in CHEM CS 11B.",49,49,1,11
DANCE 47F,Ballet II,Dance - DANCE,letters_and_science,Dance 47C.,337,218,0.6468842729970327,47
FR 104F,Business French 2,French - FR,letters_and_science,French 100 or French 26.,163,138,0.8466257668711656,104
HIST 4C,Modern Europe,History - HIST,letters_and_science,"",7455,2415,0.323943661971831,4
RG ST 196,Internship,Religious Studies - RG ST,letters_and_science,"",,,,196
THTR W 19,Design Fundamentals for Dance and Theater,Theater - THTR,letters_and_science,"",387,270,0.6976744186046512,19
C LIT 194I,Internship,Comparative Literature - C LIT,letters_and_science,Upper-division standing; Comparative Literature majors only; consent of department.,,,,194
CMPSC 180,Computer Graphics,Computer Science - CMPSC,engineering,Computer Science 130B or consent of instructor.,571,224,0.3922942206654991,180
ECON 113B,Twentieth-Century United States Economic History,Economics - ECON,letters_and_science,Economics 10A,835,415,0.49700598802395207,113
GLOBL 196SJ,"Internship in Poverty, Inequality, and Social Justice",Global Studies - GLOBL,letters_and_science,HIST 74. Consent of Instructor.,,,,196
SPAN 1,Elementary Spanish I,Spanish - SPAN,letters_and_science,"",3273,1021,0.3119462267033303,1
BIOE 120B,Cellular Bioengineering,Biological Engineering - BIOE,engineering,"BIOE 120A, or ENGR 120A, or consent of Instructor",,,,120
COMM 188,"News, Politics, & Democracy",Communication - COMM,letters_and_science,Not open to Freshmen.,77,66,0.8571428571428571,188
LAIS 174,The Hispanic Novel and Cinema,Latin American and Iberian Studies - LAIS,letters_and_science,Spanish 102L or Spanish 30 (Prerequisite may be taken concurrently).,,,,174
MES 195,Senior Honors Thesis,Middle East Studies - MES,letters_and_science,Consent of instructor and department; senior standing; open to Middle East Studies majors who have a 3.5 overall GPA and a 3.75 GPA in the major,,,,195
PHIL 161,Spinoza,Philosophy - PHIL,letters_and_science,Philosophy 100B or 100D or 100E.,134,56,0.417910447761194,161
GLOBL 99,Independent Studies,Global Studies - GLOBL,letters_and_science,Consent of department and instructor.,,,,99
INT 176LA,UCLA Health Shadowing,Interdisciplinary - INT,letters_and_science,INT 176; upper-division standing and consent of instructor,,,,176
RG ST 6,Islam and Modernity,Religious Studies - RG ST,letters_and_science,none,471,224,0.47558386411889597,6
ECE 136A,Introduction to Optics and Photonics,Electrical Computer Engineering - ECE,engineering,"PHYS 5 and PHYS 5L, or equivalent.",,,,136
ENGL 102BA,"Royalists, Radicals, and the Transformation of the Transatlantic AnglophoneWorld",English - ENGL,letters_and_science,Writing 2 or 50 or 109 or English 10 or upper-division standing.,,,,102
ENGL 103WT,Wilde Times: Late Victorian Literature and Aesthetics,English - ENGL,letters_and_science,Writing 2 or 50 or 109 or English 10 or upper-division standing.,,,,103
ENGL 141ME,Global Environmental Literatures: Ecologies of Race and Migration,English - ENGL,letters_and_science,Writing 2 or upper-division standing.,,,,141
ENGL 143HE,Humor and Ecology,English - ENGL,letters_and_science,Writing 2 or upper-division standing.,,,,143
ENV S 187,Green Building Design & Operations,Environmental Studies - ENV S,letters_and_science,Upper-division standing required.,,,,187
ESS W 2,Substance Use & Sport Nutrition,Exercise & Sport Studies - ESS,letters_and_science,"",,,,2
FAMST 193,"The Carsey-Wolf Center Practicum: Contemporary Programming, Distribution, and Exhibition",Film and Media Studies - FAMST,letters_and_science,"Film Studies 46 or upper-division standing, and consent of instructor.",,,,193
GLOBL 12,How to Think Like a Quantitative Social Scientist,Global Studies - GLOBL,letters_and_science,"",,,,12
GLOBL 196A,Study Abroad Field Research Fellowship Seminar 1,Global Studies - GLOBL,letters_and_science,"Consent of instructor; student will need to apply to the course and be actively preparing to attend an EAP (Education Abroad Program) for a portion ofthe year following the 3-part research seminar series (GLOBL 196A, B, and C). More information about the course and program can be found at https://global.ucsb.edu/undergrad/abroad.",,,,196
GLOBL 197E,Special Topics in Global and International Studies,Global Studies - GLOBL,letters_and_science,Upper-division standing.,,,,197
GREEK 143,Post-Platonic Philosophers,Greek - GREEK,letters_and_science,Greek 102.,,,,143
INT 86EI,First Year Discovery Seminar: SciTrek: How Science Works,Interdisciplinary - INT,letters_and_science,Freshman standing.,,,,86
INT 86GG,First Year Exploration Seminars,Interdisciplinary - INT,letters_and_science,Freshman standing.,,,,86
INT 86IT,First Year Exploration Seminars,Interdisciplinary - INT,letters_and_science,Freshman standing.,,,,86
INT 86JV,First Year Discovery Seminar: The Beauty of Mathematics,Interdisciplinary - INT,letters_and_science,Freshman standing.,,,,86
INT 86PZ,First Year Exploration Seminars,Interdisciplinary - INT,letters_and_science,Freshman standing.,,,,86
INT 86VL,First Year Exploration Seminars,Interdisciplinary - INT,letters_and_science,Freshman standing.,,,,86
INT 86VW,First Year Discovery Seminar: Exploration of the Physics major: from curious freshmen to young professionals,Interdisciplinary - INT,letters_and_science,Freshman standing.,,,,86
ENGL 146PB,Paper Engineering and Pop-up Literature,English - ENGL,letters_and_science,Writing 2 or upper-division standing.,,,,146
ENGL 176BC,"Performance of Literature:Race, Space, and Black California",English - ENGL,letters_and_science,Writing 2 or 50 or 109 or English 10 or upper-division standing.,,,,176
FAMST 125DT,Documentary Truths,Film and Media Studies - FAMST,letters_and_science,"",,,,125
FAMST 155CC,Directors,Film and Media Studies - FAMST,letters_and_science,Film Studies 46.,,,,155
FAMST 166QH,Queer Media Histories and Historiography,Film and Media Studies - FAMST,letters_and_science,FAMST 46.,,,,166
FAMST 187PH,Occult and Psychedelic Horror,Film and Media Studies - FAMST,letters_and_science,"Film studies 46 or upper-division standing, and consent of instructor.",,,,187
GEOG 194,Field Study of California's Coast,Geography - GEOG,letters_and_science,Consent of instructor.,,,,194
GLOBL 131,Land Uprisings and Emancipatory Alternatives,Global Studies - GLOBL,letters_and_science,Upper-division standing.,,,,131
GLOBL 193,"Capstone Seminar in Poverty, Inequality, and Social Justice",Global Studies - GLOBL,letters_and_science,Consent of instructor.,,,,193
GLOBL 196B,Study Abroad Field Research Fellowship Seminar 2,Global Studies - GLOBL,letters_and_science,"Completion of GLOBL 196A and consent of instructor (students who have not GLOBL 196A may be granted permission to enroll on a case-by-case basis); Student needs to be actively preparing to attend an EAP (Education Abroad Program) for a portion of the year following the 3-part research seminar (GLOBL 196A, B, and C).",,,,196
GLOBL 197D,Special Topics in Global and International Studies,Global Studies - GLOBL,letters_and_science,Upper-division standing.,,,,197
GLOBL 197F,Special Topics in Global and International Studies,Global Studies - GLOBL,letters_and_science,Upper-division standing.,,,,197
INT 86EB,First Year Exploration Seminars,Interdisciplinary - INT,letters_and_science,Freshman standing.,,,,86
INT 86HI,First Year Exploration Seminars,Interdisciplinary - INT,letters_and_science,Freshman standing.,,,,86
INT 86HZ,First Year Discovery Seminar:Collectors and Collecting,Interdisciplinary - INT,letters_and_science,Freshman standing.,,,,86
INT 86TK,First Year Exploration Seminars,Interdisciplinary - INT,letters_and_science,Freshman standing.,,,,86
INT 86US,Freshman Seminars,Interdisciplinary - INT,letters_and_science,Freshman standing.,,,,86
INT 86UX,First Year Exploration Seminars,Interdisciplinary - INT,letters_and_science,Freshman standing.,,,,86
INT 86WB,First Year Exploration Seminars,Interdisciplinary - INT,letters_and_science,Freshman standing.,,,,86
INT 87AC,First Year Discovery Linked Seminar:Love and Desire from the Middle Ages to the Present in Iberian and Latin American Literatures and Cultures,Interdisciplinary - INT,letters_and_science,"",,,,87
INT 87AG,First Year Discovery & Linked Seminars,Interdisciplinary - INT,letters_and_science,"",,,,87
INT 87AJ,First Year Discovery & Linked Seminars,Interdisciplinary - INT,letters_and_science,"",,,,87
INT 87AP,First Year Discovery & Linked Seminars,Interdisciplinary - INT,letters_and_science,"",,,,87
INT 187AB,Transfer Discovery & Linked Seminars,Interdisciplinary - INT,letters_and_science,Upper-division standing.,,,,187
LAIS 194,Spanish American Women's Writing,Latin American and Iberian Studies - LAIS,letters_and_science,Spanish 102L or Spanish 30 (Prerequisite may be taken concurrently).,,,,194
MUS 53,Viola Orchestral Repertoire,Music - MUS,letters_and_science,By audition.,,,,53
MUS 153,Viola Orchestral Repertoire,Music - MUS,letters_and_science,Enrollment by audition.,,,,153
MUS 175P,Eco-Acoustic-Arts:Sounding & Creating with Global Environmental Elements,Music - MUS,letters_and_science,"Upper division standing, instructor approval required.",,,,175
PHYS 7A,Basic Physics,Physics - PHYS,letters_and_science,Mathematics 2A or 3A or AP Math AB Exam with a score of 3 or better.,,,,7
PHYS 137,Planets and Exoplanets,Physics - PHYS,letters_and_science,"Physics 5 or 25 or 115A with a minimum grade of C-, Physics 104 (may be taken concurrently)",,,,137
POL S 106AD,American Political Development,Political Science - POL S,letters_and_science,"Upper-division, full POLS major standing.",,,,106
POL S 106AS,American Social Movements,Political Science - POL S,letters_and_science,"Upper-division, full POLS major standing.",,,,106
POL S 106BT,Black Political Thought,Political Science - POL S,letters_and_science,"Upper-division, full POLS major standing.",,,,106
POL S 117,Social Movement Politics,Political Science - POL S,letters_and_science,Political Science 6,,,,117
PORT 105E,Survey of Portuguese Literature from the Middle Ages to the Prese,Portuguese - PORT,letters_and_science,Upper-division standing,,,,105
SLAV 181C,Southeastern European Literature,Slavic - SLAV,letters_and_science,Upper Division standing.,,,,181
SOC W 130SG,Sociology of Globalization,Sociology - SOC,letters_and_science,Upper-division standing.,,,,130
SPAN 148B,Almodóvar's Spain:Cinema and Society,Spanish - SPAN,letters_and_science,Upper-division standing.,,,,148
SPAN 155A,Discourses of Love and Desire:from The Book of Good Love to the Present,Spanish - SPAN,letters_and_science,Spanish 30 or Spanish 102L (prerequisite may be taken concurrently).,,,,155
THTR 133A,History of Costume I,Theater - THTR,letters_and_science,"",,,,133
MUS 196,Honors Music,Music - MUS,letters_and_science,Upper-division standing; honors students only; consent of instructor and department.,,,,196
THTR 43,The People's Voice,Theater - THTR,letters_and_science,Lower-division standing.,,,,43
CH ST 99,Independent Studies,Chicano Studies - CH ST,letters_and_science,"",,,,99
CHIN 198,Readings in Chinese,Chinese - CHIN,letters_and_science,Upper-division standing; completion of 2 upper-division courses in Chinese.,,,,198
CLASS 198,Special Readings.,Classics - CLASS,letters_and_science,Consent of instructor and department chair; upper-division standing; completion of 2 upper-division courses in Classics.,,,,198
CLASS 199RA,Independent Reaesrch Assistant.,Classics - CLASS,letters_and_science,Upper-division standing; completion of 2 upper-division courses in Classicsconsent of instructor and department.,,,,199
DANCE 193HB,Senior Honors Project,Dance - DANCE,letters_and_science,Dance 193HA; senior standing.,,,,193
EARTH 190,Advanced Studies in Paleobiology,Earth Science - EARTH,letters_and_science,Consent of instructor.,,,,190
EARTH 195H,Honors Field Studies,Earth Science - EARTH,letters_and_science,Earth Science majors only; honors standing; consent of instructor.,,,,195
EACS 199,Independent Study in Asian Studies,East Asian Cultural Studies - EACS,letters_and_science,Upper division standing; completion of 2 upper division EACS courses; at least one of those two courses taken with the instructor for EACS 199; GPA for those two courses 3.5 or higher.,,,,199
ECE 96,Undergraduate Research,Electrical Computer Engineering - ECE,engineering,Consent of instructor. Must have a 3.00 GPA. May be repeated for up to 12 units.,,,,96
ENGR 199,Independent Studies in Engineering,Engineering Sciences - ENGR,engineering,Upper-division standing; consent of instructor.,,,,199
DANCE 182FL,Special Topics:Physical Practice-Flamenco,Dance - DANCE,letters_and_science,Upper-division standing.,,,,182
CHEM 104,The Science and Engineering of Energy Conversion,Chemistry and Biochemistry - CHEM,letters_and_science,Chemical Engineering 110A and 140A; or consent of instructor,,,,104
EARTH 160W,Scientific writing for the Earth Sciences,Earth Science - EARTH,letters_and_science,Earth 2,,,,160
EARTH 194RS,Practical Research Skills,Earth Science - EARTH,letters_and_science,Upper-division standing; consent of instructor.,,,,194
EACS 147T,Introduction to Daoism,East Asian Cultural Studies - EACS,letters_and_science,Upper Division Only,,,,147
EEMB 90A,Getting into the Environment:Introduction to Ecological Science and Careers,"Ecology, Evolution & Marine Biology - EEMB",letters_and_science,"",,,,90
EEMB 194R,R Seminar -Coding for Ecological and Evolutionary Analysis,"Ecology, Evolution & Marine Biology - EEMB",letters_and_science,Upper-division standing and consent of instructor.,,,,194
ECON 183,Entrepreneurial Insights,Economics - ECON,letters_and_science,ECON 100B or ECON 104B.,,,,183
ECE 194C,Group Studies in Electrical and Computer Engineering,Electrical Computer Engineering - ECE,engineering,Consent of instructor.,,,,194
ENGL 103LL,Law & Literature of the 1st Civil Rights Movement,English - ENGL,letters_and_science,Writing 2 or 50 or 109 or English 10 or upper-division standing.,,,,103
ENGL 104LC,"Literature, Culture, and Society:the 20th and 21st Century",English - ENGL,letters_and_science,Writing 2 or 50 or 109 or English 10 or upper-division standing.,,,,104
ENGL 106A,Playwriting Workshop,English - ENGL,letters_and_science,Consent of instructor.,,,,106
ENGL 134BL,"Black American Literature, 20-21st",English - ENGL,letters_and_science,Writing 2 or upper-division standing.,,,,134
FR 99,Independent Study,French - FR,letters_and_science,French 3 with a minimum grade of B.,,,,99
FR 195H,Honors Independent Studies in French,French - FR,letters_and_science,Upper-division standing; 24 upper-division units in French.,,,,195
HIST 196JC,Internship in Scholarly Publishing,History - HIST,letters_and_science,HIST 196JA and HIST 196JB,,,,196
LAIS 189,Vanguard Poetry in Spanish America,Latin American and Iberian Studies - LAIS,letters_and_science,Spanish 102L or Spanish 30 (Prerequisite may be taken concurrently).,,,,189
MCDB 194DV,Developmental Biology,"Molecular, Cellular & Develop. Biology - MCDB",letters_and_science,Upper-division standing and consent of instructor.,,,,194
RG ST 162A,Indian Philosophy,Religious Studies - RG ST,letters_and_science,Upper-division standing or instructor approval,,,,162
ARTHI 192C,Visual Technologies Internship,Art History - ARTHI,letters_and_science,"",,,,192
ARTHI 192D,On Campus Internship in the History of Art & Architecture,Art History - ARTHI,letters_and_science,"",,,,192
ARTHI 192E,Off Campus Internship in the History of Art & Architecture,Art History - ARTHI,letters_and_science,"",,,,192
BL ST 199RA,Independent Research Assistance in Black Studies,Black Studies - BL ST,letters_and_science,Upper-division standing; minimum 3.0 cumulative and major GPA for the preceding 3 quarters; completion of 2 upper-division courses in Black Studies; consent of instructor and department.,,,,199
DANCE 193H,Senior Honors Project,Dance - DANCE,letters_and_science,Senior standing.,,,,193
ARTHI 192B,Architecture and Design Collective Internship,Art History - ARTHI,letters_and_science,"",,,,192
EEMB 157A,Cell Physiology,"Ecology, Evolution & Marine Biology - EEMB",letters_and_science,"MCDB 1A, and EEMB 2 and MCDB 1B, and EEMB 3; Completion of all listed prerequisites with a grade of C- or better.",,,,157
ECE 94CC,Group Studies in Electrical and Computer Engineering,Electrical Computer Engineering - ECE,engineering,Consent of instructor.,,,,94
ECE 133,Introduction to Optimization and Learning,Electrical Computer Engineering - ECE,engineering,Upper division standing Electrical Engineering and Computer Engineering majors only.,,,,133
INT 86FH,First Year Exploration Seminars,Interdisciplinary - INT,letters_and_science,Freshman standing.,,,,86
COMM 505,Issues in Communication Research,Music Performance Laboratories - MUS A,letters_and_science,Graduate standing.,0,0,,505
COMM 597,Preparation for the Qualifying Examination,Music Performance Laboratories - MUS A,letters_and_science,Consent of graduate advisor; graduate standing.,0,0,,597
COMM 598,Master's Thesis Research and Preparation,Music Performance Laboratories - MUS A,letters_and_science,Consent of thesis advisor; graduate standing.,0,0,,598
COMM 599,Dissertation Preparation,Music Performance Laboratories - MUS A,letters_and_science,Graduate standing; consent of department; advancement to candidacy.,0,0,,599
MUS 97B,Sophomore Composition Portfolio,Music - MUS,letters_and_science,"Passing of freshman composition portfolio (may be waived for transfer students), and consent of instructor.",,,,97
MUS 122M,Practicum in World Music Performance:Arabic Maqam.,Music - MUS,letters_and_science,Upper-divison standing,,,,122
MUS 122X,Practicum in World Music Performance,Music - MUS,letters_and_science,Upper-divison standing,,,,122
MUS 135B,Piano Accompanying,Music - MUS,letters_and_science,"Music 33 (may be taken concurrently); or, Piano and Accompanying emphasis majors only; and, consent of instructor.",,,,135
MUS 195B,Junior Composition Portfolio,Music - MUS,letters_and_science,"Passing of B.M. sophomore audition; and, consent of instructor; open to upper-division Bachelor of Music Composition Emphasis major only.",,,,195
MUS A 141,Piano Ensemble,Music Performance Laboratories - MUS A,letters_and_science,Enrollment by audition. Upper-division students only.,,,,141
ARTHI 198,Independent Readings in Art History,Art History - ARTHI,letters_and_science,Consent of instructor.,,,,198
EACS 197,Senior Honors Project,East Asian Cultural Studies - EACS,letters_and_science,Open to EACS seniors only and prior approval of instructor,,,,197
EEMB 194MS,Group Studies for Advanced Students,"Ecology, Evolution & Marine Biology - EEMB",letters_and_science,Upper-division standing and consent of instructor.,,,,194
EEMB 194P,Population Ecology,"Ecology, Evolution & Marine Biology - EEMB",letters_and_science,Upper-division standing and consent of instructor.,,,,194
ENGR 120B,Cellular Bioengineering,Engineering Sciences - ENGR,engineering,Engr 120A or consent of Instructor,,,,120
ENV S 194EB,Ecology of Biological Control,Environmental Studies - ENV S,letters_and_science,Upper-division status and consent of instructor.,,,,194
GER 199RA,Independent Research Assistance in German,German - GER,letters_and_science,Upper-division standing; completion of 2 courses in upper-division German; consent of instructor and department.,,,,199
LAIS 149AD,"Blackness in Latin America, An Introduction",Latin American and Iberian Studies - LAIS,letters_and_science,History 8 or 49A or 49B or upper-division standing.,,,,149
MUS 126A,Advanced Double Bass,Music - MUS,letters_and_science,Passing of double bass sophomore audition.,,,,126
MUS 162,Choral Literature,Music - MUS,letters_and_science,Three quarters of the Music 112A-F series.,,,,162
HIST 4HA,Ancient Mediterranean-Honors,History - HIST,letters_and_science,Concurrent enrollment in HIST 4A; consent of instructor; honors standing.,,,,4
INT 84JH,Introductory Honors Seminar: Special Topics,Interdisciplinary - INT,letters_and_science,Enrollment in Letters and Science Honors Program.,,,,84
INT 86WM,First Year Exploration Seminars,Interdisciplinary - INT,letters_and_science,Freshman standing.,,,,86
INT 87AH,First Year Discovery & Linked Seminars,Interdisciplinary - INT,letters_and_science,"",,,,87
INT 87AX,First Year Discovery Linked Seminar: Campus Arts & Cultures,Interdisciplinary - INT,letters_and_science,"",,,,87
ME 103,Fundamentals of Dynamical Systems Modeling,Mechanical Engineering - ME,engineering,"",,,,103
EACS 132,Social Movements in East Asia,East Asian Cultural Studies - EACS,letters_and_science,Upper-division standing.,,,,132
EEMB 90B,Getting into the Environment: Introduction to Ecological Science and Careers II,"Ecology, Evolution & Marine Biology - EEMB",letters_and_science,"",,,,90
