acronym,name,major,college,prerequisite_text,enrollment_cnt,A_cnt,A_percentage,cardinality
ENV S 130A,"Un-naturalizing Disasters: Risk, Vulnerability, and Resilience",Environmental Studies - ENV S,letters_and_science,Environmental Studies 1 or 3 or Anthropology 2.,622,381,0.612540192926045,130
ENV S 130EV,Eco Vista: Creating Systemic Alternatives,Environmental Studies - ENV S,letters_and_science,Upper-division standing.,85,82,0.9647058823529412,130
ENV S 133,Biodiversity and Conservation Biology,Environmental Studies - ENV S,letters_and_science,"MCDB 1A, MCDB 1B, EEMB 2 and EEMB 3. Completion of all listed prerequisites with a grade of C- or better.",209,183,0.8755980861244019,133
ENV S 136O,Sustainable Architecture: History and Aesthetics,Environmental Studies - ENV S,letters_and_science,Not open to freshmen.,214,169,0.7897196261682243,136
ENV S 165A,Environmental Impact Analysis,Environmental Studies - ENV S,letters_and_science,Upper-division standing.,1090,560,0.5137614678899083,165
ENV S 171,Ecosystem Processes,Environmental Studies - ENV S,letters_and_science,"MCDB 1A, MCDB 1B, EEMB 2, and EEMB 3; or ENVS 1, 2, 3 and 60 or 100, and either Chem 1A, 1AL, 1B, and 1C or ENVS 15A, 15B, and 15BL. Completion of all listed prerequisites with a grade of C- or better.",367,132,0.35967302452316074,171
ENV S 178,Politics of the Environment,Environmental Studies - ENV S,letters_and_science,Political Science 12 or Environmental Studies 3; upper-division standing.,301,101,0.33554817275747506,178
ENV S 193CS,"People's Science: An introduction to ""citizen"" and community science",Environmental Studies - ENV S,letters_and_science,Upper-division standing.,174,95,0.5459770114942529,193
ENV S 193ST,Sea Turtle Conservation Science and Management,Environmental Studies - ENV S,letters_and_science,Upper-division standing.,143,128,0.8951048951048951,193
ENV S 197,Senior Thesis,Environmental Studies - ENV S,letters_and_science,Upper-division standing; consent of instructor.,198,167,0.8434343434343434,197
FEMST 40,"Women, Representation, and Cultural Production",Feminist Studies - FEMST,letters_and_science,"",3258,1603,0.49201964395334563,40
FEMST 133,Bodies,Feminist Studies - FEMST,letters_and_science,"Feminist Studies 20, 30, 40, 50, 60, or 80.",49,46,0.9387755102040817,133
FEMST 151DI,Sexual Cultures,Feminist Studies - FEMST,letters_and_science,Upper-division standing.,64,48,0.75,151
FEMST 159B,Women in American History,Feminist Studies - FEMST,letters_and_science,Any two quarters of History 17A-B-C or upper-division standing.,125,18,0.144,159
FEMST 161,The Social Construction of Sexuality,Feminist Studies - FEMST,letters_and_science,"",157,125,0.7961783439490446,161
FEMST 164,Cinema of Black Protest,Feminist Studies - FEMST,letters_and_science,Feminist Studies 20 or 30 or 40 or 50 or 60 or 80.,24,23,0.9583333333333334,164
FEMST 182,Feminist Methodologies,Feminist Studies - FEMST,letters_and_science,Upper-division standing; open to Feminist Studies majors only.,476,253,0.5315126050420168,182
FEMST 185BA,Gender and Culture,Feminist Studies - FEMST,letters_and_science,Upper-division standing.,38,27,0.7105263157894737,185
FEMST 195HA,Senior Honors Project,Feminist Studies - FEMST,letters_and_science,Feminist Studies 195HA; upper-division standing.,57,57,1,195
FAMST 101B,History of Cinema: The Development of Sound Film,Film and Media Studies - FAMST,letters_and_science,Film and Media Studies 46 and 70 with a minimum grade of C; open to Film and Media Studies majors only.,1122,318,0.28342245989304815,101
MUS 128D,Advanced Tuba,Music - MUS,letters_and_science,Passing of tuba sophomore audition.,,,,128
MUS 135A,Piano Accompanying,Music - MUS,letters_and_science,"Music 33 (may be taken concurrently); or, Piano and Accompanying emphasis majors only; and, consent of instructor.",,,,135
FAMST 106A,Crew Production Part One,Film and Media Studies - FAMST,letters_and_science,"Film Studies 46; and, 102 or 104 or 107; and consent of instructor.",286,176,0.6153846153846154,106
FAMST 112,Lighting for the Moving Image,Film and Media Studies - FAMST,letters_and_science,Film and Media Studies 46 or consent of instructor.,120,60,0.5,112
FAMST 122ME,Topics in National and Transnational Media: Middle East Media,Film and Media Studies - FAMST,letters_and_science,Film and Media Studies 46 or upper-division standing.,65,55,0.8461538461538461,122
FAMST 155SR,Directors: Satyajit Ray,Film and Media Studies - FAMST,letters_and_science,Film Studies 46.,89,24,0.2696629213483146,155
FAMST 163,Women and Film: Feminist Perspectives,Film and Media Studies - FAMST,letters_and_science,Film Studies 46 or upper-division standing.,105,31,0.29523809523809524,163
FAMST 165BA,Film and Social Reality: Black Auteurs,Film and Media Studies - FAMST,letters_and_science,Film Studies 46 or upper-division standing; consent of department.,150,72,0.48,165
FAMST 169,Film Noir,Film and Media Studies - FAMST,letters_and_science,Film Studies 46 or upper-division standing.,721,184,0.2552011095700416,169
FAMST 175,Experimental Film,Film and Media Studies - FAMST,letters_and_science,Film Studies 46 or upper-division standing.,134,123,0.917910447761194,175
FAMST 187AA,Topics in Film and Television Analysis: Critical Approaches to Animation,Film and Media Studies - FAMST,letters_and_science,"Film studies 46 or upper-division standing, and consent of instructor.",17,8,0.47058823529411764,187
FAMST 187GG,Topics in Film and Television Analysis: Global Genres,Film and Media Studies - FAMST,letters_and_science,"Film studies 46 or upper-division standing, and consent of instructor.",18,9,0.5,187
FAMST 187YC,Topics in Film and Television Analysis: Youth Culture,Film and Media Studies - FAMST,letters_and_science,"Film studies 46 or upper-division standing, and consent of instructor.",62,11,0.1774193548387097,187
FAMST 189TW,Topics in Contemporary Media Theory: The Wire: TV in Focus,Film and Media Studies - FAMST,letters_and_science,Film and Media Studies 46 or 70,20,13,0.65,189
FAMST 192FT,Topics in Film and Media Theory,Film and Media Studies - FAMST,letters_and_science,Film and Media 96 with a grade of C or better.,1071,479,0.44724556489262374,192
FR 50CX,Tales of Love in the Western Tradition,French - FR,letters_and_science,Writing 2.,213,145,0.6807511737089202,50
FR 101A,Foundations of French and Francophone Culture,French - FR,letters_and_science,French 100 or French 26 or equivalent.,417,211,0.5059952038369304,101
FR 149D,French Postmodern Literature,French - FR,letters_and_science,One course from French 101A-B-C series and one course from 104A-B-C-D series.,18,12,0.6666666666666666,149
FR 162A,Public Speaking in French,French - FR,letters_and_science,French 100 or equivalent.,29,20,0.6896551724137931,162
GEOG 108,Urban Geography,Geography - GEOG,letters_and_science,Geography 5.,485,175,0.36082474226804123,108
GEOG 111A,Transportation Planning and Modeling,Geography - GEOG,letters_and_science,Upper Division Unit Standing or Consent of Instructor.,463,313,0.6760259179265659,111
GEOG 112,Environmental Hydrology,Geography - GEOG,letters_and_science,Upper-division standing.,271,74,0.2730627306273063,112
GEOG 115A,Remote Sensing of the Environment 1,Geography - GEOG,letters_and_science,"Geography 3 or 3A, Upper-division standing.",839,356,0.42431466030989273,115
GEOG 133,Tropical Meteorology,Geography - GEOG,letters_and_science,Geography 110 with a grade of C or better.,111,98,0.8828828828828829,133
GEOG 140,Environmental Impacts in Human History,Geography - GEOG,letters_and_science,Upper-division standing; or consent of instructor.,102,35,0.3431372549019608,140
GEOG 141A,Population Geography,Geography - GEOG,letters_and_science,Geography 5 or equivalent course.,319,160,0.5015673981191222,141
GEOG 172,Intermediate Geographical Data Analysis,Geography - GEOG,letters_and_science,"Statistics and Applied Probability 5AA-ZZ or Ecology, Evolution & Marine Biology 30 or Psychology 5 or Communication 87.",421,202,0.47980997624703087,172
GER 4,Intermediate German,German - GER,letters_and_science,Grade of P or grade of C or better in German 3. Not open for credit to students who have completed more advanced work in German.,737,657,0.8914518317503393,4
GER 101A,Advanced German,German - GER,letters_and_science,German 6.,469,436,0.929637526652452,101
GER 106,Advanced Reading and Writing Skills,German - GER,letters_and_science,German 1-6 or equivalent,187,167,0.893048128342246,106
GER 164H,Major Works in German Literature:Heidegger,German - GER,letters_and_science,Upper-division standing.,13,12,0.9230769230769231,164
GER 187,The Devil in Literature,German - GER,letters_and_science,Upper-division standing.,37,28,0.7567567567567568,187
GLOBL 112,Global Refugee Migration,Global Studies - GLOBL,letters_and_science,Upper-division standing.,29,17,0.5862068965517241,112
GLOBL 140,Global Racial Justice,Global Studies - GLOBL,letters_and_science,Global Studies 1 and 2; upper-division standing.,53,35,0.660377358490566,140
GREEK 100,Introduction To Greek Prose,Greek - GREEK,letters_and_science,Greek 3 with a grade of C or better.,50,37,0.74,100
HEB 1,Elementary Hebrew,Hebrew - HEB,letters_and_science,"",271,202,0.7453874538745388,1
HIST 4A,The Ancient Mediterranean,History - HIST,letters_and_science,"",550,312,0.5672727272727273,4
HIST 5,The History of the Present,History - HIST,letters_and_science,"",1032,442,0.42829457364341084,5
HIST 8A,Latin American History:Pre-Columbian and Colonial Periods,History - HIST,letters_and_science,"",149,93,0.6241610738255033,8
HIST 17A,The American People,History - HIST,letters_and_science,"",4918,2104,0.4278161854412363,17
RG ST 188A,Seminar in Civic Engagement and Deliberative Democracy,Religious Studies - RG ST,letters_and_science,"",0,0,,188
SOC 98,Readings in Sociology,Sociology - SOC,letters_and_science,Consent of instructor and department.,,,,98
HIST 46B,The Middle East:From the Nineteenth Century to the Present,History - HIST,letters_and_science,"",595,452,0.7596638655462185,46
HIST 49A,Survey of African History,History - HIST,letters_and_science,"",670,343,0.5119402985074627,49
HIST 106B,"The Scientific Revolution, 1500 to 1800",History - HIST,letters_and_science,HIST 4B or upper-division standing.,220,89,0.40454545454545454,106
HIST 115A,The Worlds of Medieval Italy,History - HIST,letters_and_science,History 2B or 4B or upper division standing.,155,58,0.3741935483870968,115
HIST 124A,"Women, Gender, and Sexuality in Europe, 1750-1914",History - HIST,letters_and_science,History 2C or 4C or Upper Division Standing.,130,82,0.6307692307692307,124
HIST 133D,The Nazi Holocaust and Other Genocides,History - HIST,letters_and_science,History 2C or 4C.,631,273,0.4326465927099842,133
HIST 133Q,Readings on the Holocaust,History - HIST,letters_and_science,History 33D or 133B or 133C or 133D (may be taken concurrently).,46,24,0.5217391304347826,133
HIST 135C,History of Russia,History - HIST,letters_and_science,History 4B or 4C or upper-division standing.,675,248,0.3674074074074074,135
HIST 136M,History of U.S.-Mexican Relations,History - HIST,letters_and_science,History 9 or 8 or 17A or 168B,113,67,0.5929203539823009,136
HIST 145A,The Middle East I: From the Origins of Islam to the Year 1000,History - HIST,letters_and_science,History 46 or MES 45 or upper-division standing.,241,83,0.34439834024896265,145
HIST 147R,Undergraduate Research Seminar in African History,History - HIST,letters_and_science,Upper Division standing.,111,49,0.44144144144144143,147
HIST 149AD,"Blackness in Latin America, An Introduction",History - HIST,letters_and_science,History 8 or 49A or 49B OR upper division standing,69,37,0.5362318840579711,149
HIST 159B,Women in American History,History - HIST,letters_and_science,Any two quarters of History 17A-B-C or upper-division standing.,564,129,0.22872340425531915,159
HIST 162B,Antislavery Movements in the United States,History - HIST,letters_and_science,Upper-Division Standing,181,75,0.4143646408839779,162
HIST 168A,History of the Chicanos,History - HIST,letters_and_science,History 17A or 17B or 17C or Chicano Studies 1A or 1B or 1C or upper- division standing.,303,171,0.5643564356435643,168
HIST 184E,History of Trans-Eurasian Exchanges,History - HIST,letters_and_science,"History 2A, or 2B, or 2C",40,23,0.575,184
HIST 187R,Undergraduate Research Seminar in Japanese History,History - HIST,letters_and_science,History 87 or upper-division standing.,65,41,0.6307692307692307,187
HIST 194AH,Senior Honors Seminar,History - HIST,letters_and_science,Admission to senior honors program.,120,116,0.9666666666666667,194
INT 24,Promoting Transfer Student Success Through Engagement,Interdisciplinary - INT,letters_and_science,None,408,404,0.9901960784313726,24
INT 84AD,Introductory Honors Seminar: Special Topics,Interdisciplinary - INT,letters_and_science,Enrollment in Letters and Science Honors Program.,26,26,1,84
INT 84CE,Introductory Honors Seminar: Special Topics,Interdisciplinary - INT,letters_and_science,Enrollment in Letters and Science Honors Program.,54,54,1,84
INT 84CS,Introductory Honors Seminar: Special Topics,Interdisciplinary - INT,letters_and_science,Enrollment in Letters and Science Honors Program.,17,17,1,84
INT 84CT,Introductory Honors Seminar:Special Topics,Interdisciplinary - INT,letters_and_science,Enrollment in Letters and Science Honors Program.,13,13,1,84
INT 84CU,Introductory Honors Seminar: Special Topics,Interdisciplinary - INT,letters_and_science,Enrollment in Letters and Science Honors Program.,17,13,0.7647058823529411,84
INT 84CV,Introductory Honors Seminar: Special Topics,Interdisciplinary - INT,letters_and_science,Enrollment in Letters and Science Honors Program.,18,14,0.7777777777777778,84
INT 84ZW,Introductory Honors Seminar: Special Topics,Interdisciplinary - INT,letters_and_science,Enrollment in Letters and Science Honors Program; lower-division standing.,123,123,1,84
INT 94BE,First Year Exploration Seminars,Interdisciplinary - INT,letters_and_science,Freshman standing.,19,19,1,94
INT 94EI,First Year Exploration Seminars,Interdisciplinary - INT,letters_and_science,Freshman standing.,105,101,0.9619047619047619,94
INT 94UE,First Year Exploration Seminars,Interdisciplinary - INT,letters_and_science,Freshman standing.,19,19,1,94
INT 94WM,First Year Exploration Seminars,Interdisciplinary - INT,letters_and_science,Freshman standing.,17,17,1,94
INT 95A,The Modern Research University,Interdisciplinary - INT,letters_and_science,"",3735,3669,0.9823293172690764,95
INT 98RA,Introduction to Research,Interdisciplinary - INT,letters_and_science,Consent of Instructor,6,6,1,98
INT 126,Training for Undergraduate Mentoring,Interdisciplinary - INT,letters_and_science,Upper-division standing; consent of instructor.,194,194,1,126
INT 187AN,Transfer Discovery & Linked Seminars,Interdisciplinary - INT,letters_and_science,Upper-division standing.,144,144,1,187
INT 189BE,Senior Transfer Exploration Seminars,Interdisciplinary - INT,letters_and_science,Senior standing.,30,28,0.9333333333333333,189
ITAL 101,Advanced Reading and Composition: Modern Italy,Italian - ITAL,letters_and_science,Italian 6 or equivalent,156,106,0.6794871794871795,101
ITAL 139FX,Gastronomic Italy: Italian Food Culture in Transnational Perspective,Italian - ITAL,letters_and_science,Upper division standing.,130,85,0.6538461538461539,139
ITAL 180X,Italian Cinema,Italian - ITAL,letters_and_science,Upper-Division Standing only,111,43,0.38738738738738737,180
JAPAN 4,Second-Year Japanese,Japanese - JAPAN,letters_and_science,"Japanese 3 with grade C or better, or equivalent",814,485,0.5958230958230958,4
JAPAN 112,Survey of Modern Japanese Literature,Japanese - JAPAN,letters_and_science,Upper-division standing.,413,170,0.4116222760290557,112
JAPANW 120A,Third-Year Japanese I,Japanese - JAPAN,letters_and_science,"Japanese 6 with grade C or better, or equivalent",40,27,0.675,120
JAPAN 144,Advanced Japanese Readings I,Japanese - JAPAN,letters_and_science,Japanese 120C or 125.,211,140,0.6635071090047393,144
JAPAN 156,The Cultural Roots of the Japanese Horror Film,Japanese - JAPAN,letters_and_science,Upper division standing or instructor approval,73,39,0.5342465753424658,156
THTR 193HA,Senior Honors Project,Theater - THTR,letters_and_science,Senior standing.,,,,193
THTR 199RA,Independent Research Assistance in Theater,Theater - THTR,letters_and_science,Upper-division standing; completion of 2 upper-division courses in Theater; consent of instructor and department.,,,,199
JAPAN 181,Introduction to Classical Japanese,Japanese - JAPAN,letters_and_science,Japanese 120C or 125.,124,107,0.8629032258064516,181
KOR 4,Second Year Korean,Korean - KOR,letters_and_science,"Korean 1, 2, 3.",135,97,0.7185185185185186,4
KOR 199,Independent Studies,Korean - KOR,letters_and_science,Upper-division standing; completion of 2 upper-division Korean courses; one of those two courses taken with the instructor for KOR 199; GPA for those two courses 3.5 or higher,4,4,1,199
LATIN 100,Introduction To Latin Prose,Latin - LATIN,letters_and_science,Latin 3 with a grade of C or better.,139,81,0.5827338129496403,100
LATIN 103,Medieval Latin Readings,Latin - LATIN,letters_and_science,"Latin 1, 2, and 3.",43,42,0.9767441860465116,103
LING 50,Language and Power,Linguistics - LING,letters_and_science,"",1885,1227,0.6509283819628647,50
LING 101,Basic Elements Of Linguistic Analysis,Linguistics - LING,letters_and_science,Linguistics 20.,505,271,0.5366336633663367,101
LING 102,Programming for Linguists,Linguistics - LING,letters_and_science,"",101,67,0.6633663366336634,102
LING 117,Regional Dialects and Varieties of English Around the World,Linguistics - LING,letters_and_science,Linguistics 20.,390,139,0.3564102564102564,117
LING 127,Psychology of Language,Linguistics - LING,letters_and_science,Linguistics 20,665,341,0.512781954887218,127
LING 134,North American Indigenous Languages,Linguistics - LING,letters_and_science,Linguistics 20.,66,37,0.5606060606060606,134
LING 141,Second Language Acquisition,Linguistics - LING,letters_and_science,Upper-division standing.,322,217,0.6739130434782609,141
MATRL 100A,Structure and Properties I,Materials - MATRL,engineering,"Chemistry 1A-B; Physics 4; and Mathematics 4B, 6A, 6B",598,295,0.49331103678929766,100
MATRL 162A,The Quantum Description of Electronic Materials,Materials - MATRL,engineering,"ECE 130A-B and 134 with a minimum grade of C- in all; open to EE, senior students in the BS/MS programs and Materials graduate students only.",2,1,0.5,162
MATRL 185,Materials in Engineering,Materials - MATRL,engineering,Materials 100B or 101.,28,25,0.8928571428571429,185
MATH 2A,Calculus with Algebra and Trigonometry,Mathematics - MATH,letters_and_science,Qualifying score on the Mathematics Placement Exam.,721,394,0.5464632454923717,2
MATH 94,Group Studies in Mathematics,Mathematics - MATH,letters_and_science,Mathematics 3C or 3CI or 4A or 4AI or 4B or 4BI or 5A or 5AI or 5B or 5BI or 5C or 6A or 6AI or 6B with a grade of B or better.,270,241,0.8925925925925926,94
MATH CS 101A,Problem Solving I,Mathematics - MATH,creative_studies,None.,147,147,1,101
MATH 102A,Modern Euclidean and Noneuclidean Geometry,Mathematics - MATH,letters_and_science,Math 8 with a minimum grade of C.,577,190,0.3292894280762565,102
MATH 111A,Introduction to Abstract Algebra,Mathematics - MATH,letters_and_science,"Mathematics 8 and 108A with a grade of ""C"" or better.",854,331,0.3875878220140515,111
MATH 113,Non-euclidean Geometry,Mathematics - MATH,letters_and_science,"Mathematics 8 with a grade of ""C"" or better.",445,186,0.41797752808988764,113
MATH 118A,Introduction to Real Analysis,Mathematics - MATH,letters_and_science,"Mathematics 5A or 5AI and 5B or 5BI; or 4B or 4BI and 6A or 6AI; and 108A and 117 each with a grade of ""C"" or better.",1267,465,0.367008681925809,118
MATH 119A,Ordinary Differential Equations,Mathematics - MATH,letters_and_science,Mathematics 5A or 5AI and 5B or 5BI with a minimum grade of C; or 4B or 4BI and 6A or 6AI with a minimum grade of C; and Math 8 with a minimum grade of C.,792,310,0.39141414141414144,119
MATH CS 120FN,Special Topics in Mathematics: Number Systems,Mathematics - MATH,creative_studies,Consent of instructor.,58,58,1,120
MATH CS 121,Probability,Mathematics - MATH,creative_studies,None.,118,118,1,121
MATH CS 128,Introduction to the Higher Mathematics,Mathematics - MATH,creative_studies,None.,155,155,1,128
MATH 190,Special Topics in Mathematics,Mathematics - MATH,letters_and_science,Mathematics 3C or 3CI or 4A or 4AI or 4B or 4BI or 5A or 5AI or 5B or 5BI or 5C or 6A or 6AI or 6B with a grade of B or better. Concurrent enrollment in Math 94.,180,96,0.5333333333333333,190
ME 11,Introductory Concepts in Mechanical Engineering,Mechanical Engineering - ME,engineering,Lower-division standing.,796,779,0.9786432160804021,11
ME 18,Toy Product Design,Mechanical Engineering - ME,engineering,"",29,25,0.8620689655172413,18
ME 105,Mechanical Engineering Laboratory,Mechanical Engineering - ME,engineering,"ME 151B, 152B, 163; and, Materials 101 or 100B.",1027,502,0.48880233690360275,105
ME 107,Machine Learning,Mechanical Engineering - ME,engineering,"",36,33,0.9166666666666666,107
ME 128,Design of Biomedical Devices,Mechanical Engineering - ME,engineering,"Mechanical Engineering 10, 14, 15, 16, and 153; open to ME majors only.",262,229,0.8740458015267175,128
ME 140A,Numerical Analysis in Engineering,Mechanical Engineering - ME,engineering,"ME 17 with a minimum grade of C-, or Chemical Engineering 132A.",829,322,0.3884197828709288,140
ME 151A,Thermosciences 1,Mechanical Engineering - ME,engineering,"Physics 2; ME 14 with a minimum grade of C-; and, Mathematics 5C or Mathematics 6B.",1037,291,0.2806171648987464,151
ME 152A,Fluid Mechanics,Mechanical Engineering - ME,engineering,"Mathematics 5C or Math 6B; and, ME 16 with a minimum grade of C-.",1143,449,0.39282589676290464,152
ME 154,Design and Analysis of Structures,Mechanical Engineering - ME,engineering,"ME 15 with a minimum grade of C-; and, ME 16 with a minimum grade of C-; open to ME majors only.",575,297,0.5165217391304348,154
ME 156A,Mechanical Engineering Design - I,Mechanical Engineering - ME,engineering,"ME 14, with a minimum grade of C-; and ME 15, with a minimum grade of C-; and MATRL 101 (or MATRL 100B); or consent of instructor. Open to ME majors only",1093,383,0.3504117108874657,156
ME 157,Introduction to Multiphysics Simulation,Mechanical Engineering - ME,engineering,Mechanical Engineering 151A-B; and Mechanical Engineering 152A-B,191,167,0.8743455497382199,157
C LIT 186EB,Basque Studies Through Literature and Culture in Translation (Spanish/English),Comparative Literature - C LIT,letters_and_science,Upper-division standing.,,,,186
C LIT 199RA,Independent Research Assistance,Comparative Literature - C LIT,letters_and_science,"Upper-division standing; completion of two upper-division courses in Comparative Literature; and, consent of instructor.",,,,199
EARTH 194CC,Carbon Cycle Seminar,Earth Science - EARTH,letters_and_science,Upper-division standing; consent of instructor.,,,,194
ME 179D,Introduction to Robotics: Dynamics and Control,Mechanical Engineering - ME,engineering,ECE 130A or ME 155A (may be taken concurrently),84,65,0.7738095238095238,179
ME 179L,Introduction to Robotics: Design Laboratory,Mechanical Engineering - ME,engineering,Engr 3; and ME 6 or ECE 2A. Not open for credit to students who have completed ME 170C or ECE 181C.,334,305,0.9131736526946108,179
ME 185,Materials in Engineering,Mechanical Engineering - ME,engineering,Materials 100B or 101.,41,31,0.7560975609756098,185
ME 189A,Capstone Mechanical Engineering Design Project,Mechanical Engineering - ME,engineering,ME 151C; and ME 152B; and ME 153; and ME 163; or consent of instructor. Open to ME majors only.,910,670,0.7362637362637363,189
MAT 80TH,Mediated Worlds/THEMAS Technologies+Humanities Emphasis,Media Arts and Technology - MAT,letters_and_science,"",192,79,0.4114583333333333,80
MS 1A,Introduction to Leadership I,Military Science - MS,letters_and_science,none,228,225,0.9868421052631579,1
MS 2AA,Foundations of Leadership I,Military Science - MS,letters_and_science,none,220,217,0.9863636363636363,2
MS 131,Tactical leadership I,Military Science - MS,letters_and_science,Junior standing.,198,188,0.9494949494949495,131
MS 141,Developmental Leadership I,Military Science - MS,letters_and_science,Military Science 133; senior standing.,160,152,0.95,141
MCDB 1AZ,Selected Topics from MCDB 1A,"Molecular, Cellular & Develop. Biology - MCDB",letters_and_science,Consent of department.,89,64,0.7191011235955056,1
MCDB 11,Biology Mentoring and Engagement I,"Molecular, Cellular & Develop. Biology - MCDB",letters_and_science,Concurrent enrollment in Chemistry 1A or Chemistry 2A.,1944,1940,0.9979423868312757,11
MCDB 15HG,"Past, Present, and Future of the Human Genome","Molecular, Cellular & Develop. Biology - MCDB",letters_and_science,Freshmen/1st year Prebiology majors only.,62,61,0.9838709677419355,15
MCDB 15SF,Biology in Science Fiction,"Molecular, Cellular & Develop. Biology - MCDB",letters_and_science,Freshmen/1st year Prebiology majors only.,55,55,1,15
MCDB 101L,Molecular Genetics Laboratory,"Molecular, Cellular & Develop. Biology - MCDB",letters_and_science,MCDB 101A-B or EEMB 129; MCDB 101B may be taken concurrently. Completion of all listed prerequisites with a grade of C or better.,276,197,0.7137681159420289,101
MCDB 103,Cell Biology,"Molecular, Cellular & Develop. Biology - MCDB",letters_and_science,"MCDB 1A, and EEMB 2 and MCDB 1B. Completion of all listed prerequisites wita grade of C or better.",2419,641,0.2649855312112443,103
MCDB 126,Basic Pharmacology,"Molecular, Cellular & Develop. Biology - MCDB",letters_and_science,MCDB 101A (may be taken concurrently) or Chemistry 142C; Chemistry 109A-B-C. Completion of all listed prerequisites with a grade of C or better.,277,58,0.20938628158844766,126
