acronym,name,major,college,prerequisite_text,enrollment_cnt,A_cnt,A_percentage,cardinality
INT CS 130WM,"CCS Crossroads - Alternative Foods, Alternative Economies: Creative Collaborations to Reimagine the Food System",Interdisciplinary - INT,creative_studies,"",36,36,1,130
INT 137RS,Recovering Untold Stories: From the First Millennium to Today,Interdisciplinary - INT,letters_and_science,"Upper-division standing; or, INT 36AA-ZZ.",192,136,0.7083333333333334,137
INT 185ST,Word Magazine,Interdisciplinary - INT,letters_and_science,Upper-division standing.,830,773,0.9313253012048193,185
INT 185VW,Interdisciplinary Humanities Seminar,Interdisciplinary - INT,letters_and_science,Upper-division standing; consent of instructor.,120,107,0.8916666666666667,185
INT 186AS,Transfer Exploration Seminars,Interdisciplinary - INT,letters_and_science,Upper-division standing.,178,165,0.9269662921348315,186
INT 186AW,Transfer Exploration Seminars,Interdisciplinary - INT,letters_and_science,Upper-division standing.,77,74,0.961038961038961,186
INT 186BK,Transfer Exploration Seminars,Interdisciplinary - INT,letters_and_science,Upper-division standing.,11,11,1,186
INT 187AL,Transfer Discovery & Linked Seminars,Interdisciplinary - INT,letters_and_science,Upper-division standing.,58,56,0.9655172413793104,187
INT 190MA,Junior Seminar for McNair Scholars,Interdisciplinary - INT,letters_and_science,Admission to McNair Scholars Program; junior standing.,125,124,0.992,190
INT 190MB,Senior Seminar for McNair Scholars,Interdisciplinary - INT,letters_and_science,Admission to McNair Scholars Program; senior standing.,93,93,1,190
INT 192DC,Washington Center Internship,Interdisciplinary - INT,letters_and_science,Upper-division standing; consent of instructor; acceptance to Washington Center.,764,757,0.9908376963350786,192
INT 199DC,Independent Research At Washington Center,Interdisciplinary - INT,letters_and_science,Upper-division standing; consent of instructor; acceptance to Washington Center.,675,413,0.6118518518518519,199
INT 199H,Honors Independent Studies,Interdisciplinary - INT,letters_and_science,Upper-division Letters & Science Honors Program students only.,21,20,0.9523809523809523,199
ITAL 1,Elementary Italian,Italian - ITAL,letters_and_science,"",3812,2430,0.6374606505771249,1
ITAL 1HY,Elementary Italian 1 Hybrid,Italian - ITAL,letters_and_science,"",237,168,0.7088607594936709,1
ITAL 2,Elementary Italian,Italian - ITAL,letters_and_science,Italian 1 or equivalent.,2328,1249,0.5365120274914089,2
ITAL 2HY,Elementary Italian 2 Hybrid,Italian - ITAL,letters_and_science,Completion of Italian 1 or Italian 1HY with a grade of P or a grade of C or higher.,125,70,0.56,2
ITAL 4,Intermediate Italian,Italian - ITAL,letters_and_science,Italian 3; or Italian 16B.,687,297,0.43231441048034935,4
ITAL 5,Intermediate Italian,Italian - ITAL,letters_and_science,Italian 4.,551,249,0.4519056261343013,5
ITAL 16A,Italian for Spanish Speakers I,Italian - ITAL,letters_and_science,1 year of college Spanish; or 3 years of high school Spanish; or be native or heritage speaker of Spanish.,152,119,0.7828947368421053,16
ITAL 20X,Introduction to Italian Culture,Italian - ITAL,letters_and_science,"",2418,1130,0.46732837055417703,20
ITAL 102,Advanced Reading and Composition: Medieval and Renaissance Italy,Italian - ITAL,letters_and_science,Italian 6 or equivalent,142,88,0.6197183098591549,102
ITAL 119A,The Art of Translation,Italian - ITAL,letters_and_science,Italian 1-6 or equivalent,99,78,0.7878787878787878,119
ITAL 139GX,Emigrant Nation and Charisma in the Making of Italians,Italian - ITAL,letters_and_science,Upper division standing.,32,13,0.40625,139
ITAL 144A,"Women, Gender, and Sexuality in Italy",Italian - ITAL,letters_and_science,"Note: ITAL 144XX is the ""in translation (in English) version of this",25,21,0.84,144
ITAL 195H,Senior Honors Independent Studies in Italian,Italian - ITAL,letters_and_science,Senior standing; completion of 24 upper-division units in Italian.,1,1,1,195
ITAL 199,Independent Studies in Italian,Italian - ITAL,letters_and_science,Upper-division standing; completion of 2 upper-division courses in Italian.,6,5,0.8333333333333334,199
ITAL 199RA,Independent Research Assistance,Italian - ITAL,letters_and_science,Upper-division standing; completion of 2 upper-division courses in Italian;consent of instructor.,7,6,0.8571428571428571,199
JAPAN 2,First-Year Japanese II,Japanese - JAPAN,letters_and_science,"Japanese 1 with grade C or better, or equivalent.",1532,1059,0.6912532637075718,2
JAPAN 5,Second-Year Japanese,Japanese - JAPAN,letters_and_science,"Japanese 4 with grade C or better, or equivalent",656,397,0.6051829268292683,5
JAPAN 120B,Third-Year Japanese II,Japanese - JAPAN,letters_and_science,"Japanese 120A with grade C or better, or equivalent",355,222,0.6253521126760564,120
JAPAN 145,Advanced Japanese Readings II,Japanese - JAPAN,letters_and_science,Japanese 144.,171,134,0.783625730994152,145
JAPAN 150,Globalizing Japan: Culture and Society,Japanese - JAPAN,letters_and_science,upper division standing,181,110,0.6077348066298343,150
JAPAN 165,Popular Culture in Japan,Japanese - JAPAN,letters_and_science,"",1035,669,0.6463768115942029,165
JAPAN 167A,Religion in Japanese Culture,Japanese - JAPAN,letters_and_science,Upper division standing or instructor approval,150,55,0.36666666666666664,167
JAPAN 169,Seminar in Traditional Japanese Drama,Japanese - JAPAN,letters_and_science,Japanese 149 or instructor approval,16,12,0.75,169
JAPAN 180DL,"Death, Love & Money in Modern Japan",Japanese - JAPAN,letters_and_science,Upper Division Standing,34,29,0.8529411764705882,180
JAPAN 183,Readings in Premodern through Meiji Japanese Texts,Japanese - JAPAN,letters_and_science,Japanese 181.,68,50,0.7352941176470589,183
JAPAN 199,Independent Studies in Japanese,Japanese - JAPAN,letters_and_science,Upper-division standing; completion of 2 upper-division courses in Japanese; at least one of those two courses taken with instructor for Japan 199; GPA for those two courses 3.5 or higher,2,2,1,199
JAPAN 199RA,Independent Research Assistance,Japanese - JAPAN,letters_and_science,Completion of at least 2 upper-division courses in Japanese studies or EastAsian Cultural Studies; consent of instructor and department.,1,1,1,199
KOR 2,First Year Korean,Korean - KOR,letters_and_science,Korean 1.,341,259,0.7595307917888563,2
KOR 5,Second Year Korean,Korean - KOR,letters_and_science,"Korean 1, 2, 3, 4.",130,91,0.7,5
LAIS 100S,Introduction to Latin American and Iberian Studies,Latin American and Iberian Studies - LAIS,letters_and_science,Upper-division standing,14,7,0.5,100
LAIS 101,Interdisciplinary Approaches to the History and Societies of Latin America and Iberia,Latin American and Iberian Studies - LAIS,letters_and_science,Upper-division standing.,648,309,0.47685185185185186,101
LAIS 195A,Senior Honors Thesis,Latin American and Iberian Studies - LAIS,letters_and_science,Admission to honors program; consent of department.,1,1,1,195
LAIS 195B,Senior Honors Thesis,Latin American and Iberian Studies - LAIS,letters_and_science,Admission to honors program; consent of department.,1,1,1,195
LING 2G,EMS:Intermediate Graduate Writing for International Students,Linguistics - LING,letters_and_science,Placement based on English Language Placement Examination.,350,346,0.9885714285714285,2
LING 3A,EMS:Academic English,Linguistics - LING,letters_and_science,Placement based on Analytical Writing Placement Exam (AWPE)and English Language Placement Examination (ELPE).,1381,1296,0.9384503982621288,3
LING 3B,EMS:Academic English,Linguistics - LING,letters_and_science,Open to students who have a Ling 3B placement or a prerequisite of Ling 3A with a pass grade.,2773,1742,0.6282005048683736,3
LING 3C,EMS:Academic English,Linguistics - LING,letters_and_science,Open to students who have a Ling 3C placement or a prerequisite of Ling 3B with a grade of C or better.,3264,2104,0.6446078431372549,3
LING 4,EMS:Individual and Small Group Instruction for International Graduate Students,Linguistics - LING,letters_and_science,Consent of the instructor.,572,572,1,4
LING 8,Oral Communication for International Undergraduate Students,Linguistics - LING,letters_and_science,"",310,255,0.8225806451612904,8
LING 10,Academic Reading Across the Curriculum,Linguistics - LING,letters_and_science,Undergraduate-standing.,68,42,0.6176470588235294,10
LING 12,EMS:Approaches to University Writing for Multilingual Students,Linguistics - LING,letters_and_science,Open to students who have not satisfied the Entry Level Writing Requirement and have a Ling 12 placement or a prerequisite of Ling 3C with a grade of C or better.,3336,2303,0.690347721822542,12
LING W 12,EMS:Approaches to University Writing for Multilingual Students,Linguistics - LING,letters_and_science,Open to students who have not satisfied the Entry Level Writing Requirement and have a Ling 12 placement or a prerequisite of Ling 3C with a grade of C or better.,359,279,0.7771587743732591,12
LING 14,Vocabulary and Grammar in Academic Writing for Multilingual Students,Linguistics - LING,letters_and_science,"",185,126,0.6810810810810811,14
LING 20,Language And Linguistics,Linguistics - LING,letters_and_science,"",4060,1636,0.40295566502463054,20
LING 70,Language In Society,Linguistics - LING,letters_and_science,"",2651,1691,0.6378725009430404,70
LING 99,Independent Studies In Linguistics.,Linguistics - LING,letters_and_science,NONE,16,14,0.875,99
LING 104,Statistical Methods in Linguistics,Linguistics - LING,letters_and_science,Upper-division or consent of instructor.,152,67,0.4407894736842105,104
LING 107,Introduction to Phonology,Linguistics - LING,letters_and_science,Linguistics 106.,812,378,0.46551724137931033,107
LING 109,Introduction To Syntax,Linguistics - LING,letters_and_science,Linguistics 101 OR Linguistics 108,669,295,0.44095665171898357,109
LING 110,Foundations of Computational Linguistics,Linguistics - LING,letters_and_science,Linguistics 102 or Computer Science 8 or equivalent experience.,290,157,0.5413793103448276,110
LING 124,Discourse Analysis,Linguistics - LING,letters_and_science,"Linguistics 20 or 109, or consent of instructor.",136,88,0.6470588235294118,124
LING 139,Introduction to Teaching English to Speakers of Other Languages,Linguistics - LING,letters_and_science,"",318,230,0.7232704402515723,139
LING 145,Articulatory Phonetics,Linguistics - LING,letters_and_science,Linguistics 106,259,149,0.5752895752895753,145
LING 195A,Honors Thesis,Linguistics - LING,letters_and_science,Senior standing; consent of instructor.,7,6,0.8571428571428571,195
LING 195B,Honors Thesis.,Linguistics - LING,letters_and_science,Senior standing; consent of instructor.,7,6,0.8571428571428571,195
LING 195C,Honors Thesis,Linguistics - LING,letters_and_science,Linguistics 195B.,5,4,0.8,195
LING 199,Independent Studies In Linguistics.,Linguistics - LING,letters_and_science,Upper-division standing; completion of 2 upper-division courses in linguistics; consent of instructor.,347,338,0.9740634005763689,199
MATRL 10,"Materials in Society, The Stuff of Dreams",Materials - MATRL,engineering,"Not open to engineering, pre-computer science, or computer science majors.",265,97,0.3660377358490566,10
MATRL 100B,Structures and Properties II,Materials - MATRL,engineering,Materials 100A.,466,202,0.4334763948497854,100
MATRL 101,Introduction to the Structure and Properties of Materials,Materials - MATRL,engineering,"",1466,506,0.3451568894952251,101
MATRL 135,Biophysics and Biomolecular Materials,Materials - MATRL,engineering,Physics 5 or 6C or 25.,135,125,0.9259259259259259,135
MATRL 160,Introduction to Polymer Science,Materials - MATRL,engineering,Chemical Engineering 110A or Chemistry 113A or equivalent.,90,28,0.3111111111111111,160
MATRL 162B,Fundamentals of the Solid State,Materials - MATRL,engineering,"ECE 162A with a minimum grade of C-; open to EE, senior students in the BS/MS programs and Materials graduate students only.",5,5,1,162
MATRL 186A,Manufacturing and Materials,Materials - MATRL,engineering,ME 151C; and ME 15; and Materials 101 or Materials 100C,4,1,0.25,186
MATH 2B,Calculus with Algebra and Trigonometry,Mathematics - MATH,letters_and_science,Mathematics 2A with a minimum grade of C.,642,252,0.3925233644859813,2
MATH 3A,"Calculus with Applications, First Course",Mathematics - MATH,letters_and_science,Qualifying score on the Mathematics Placement Exam.,10855,3438,0.3167204053431598,3
MATH 3B,"Calculus with Applications, Second Course",Mathematics - MATH,letters_and_science,Mathematics 3A with a minimum grade of C.,19530,7098,0.3634408602150538,3
MATH 4A,Linear Algebra with Applications,Mathematics - MATH,letters_and_science,Math 2B or 3B or 3BI with a minimum grade of C.,21252,10445,0.49148315452663277,4
MATH 4B,Differential Equations,Mathematics - MATH,letters_and_science,Math 4A or Math 4AI with a minimum grade of C.,15046,7845,0.5214010368204174,4
MATH 6A,"Vector Calculus with Applications, First Course",Mathematics - MATH,letters_and_science,Mathematics 4A (or 4AI) or Mathematics 5A (or 5AI) with a letter grade of C or better.,14490,6542,0.45148378191856453,6
MATH 6B,"Vector calculus with Applications, Second Course",Mathematics - MATH,letters_and_science,"Mathematics 5B or 5BI with a minimum grade of C; or, Mathematics 4B (or 4BI) and Mathematics 6A (or 6AI), each with a minimum grade of C.",8179,3418,0.4178994987162245,6
MATH 8,Transition to Higher Mathematics,Mathematics - MATH,letters_and_science,Mathematics 3C or 3CI or 4A or 4AI or 4B or 4BI or 5A or 5AI or 5B or 5BI or 5C or 6A or 6AI or 6B with a grade of B or better.,8335,3231,0.38764247150569886,8
MATH 34B,Calculus for Social and Life Sciences,Mathematics - MATH,letters_and_science,Mathematics 2A or 3A or 3AS or 34A with a Grade of C or better.,13875,6305,0.45441441441441444,34
MATH 101A,Classical Number Systems,Mathematics - MATH,letters_and_science,"Math 8 with a grade of ""C"" or better.",516,166,0.32170542635658916,101
MATH CS 101B,Problem Solving II,Mathematics (Creative Studies) - MATH CS,creative_studies,None.,135,135,1,101
MATH 102B,Modern Euclidean and Noneuclidean Geometry,Mathematics - MATH,letters_and_science,Math 102A with a minimum grade of C.,378,154,0.4074074074074074,102
MATH 104A,Introduction Into Numerical Analysis,Mathematics - MATH,letters_and_science,"Mathematics 4B or 4BI, 6A or 6AI, and 6B; or 5A or 5AI, 5B or 5BI and 5C; and Math 117; and, Computer Science 5AA-ZZ or 10 or 8 or 16 or Engineering 3. A grade of C or above is required in all prerequisite courses.",2357,1075,0.45608824777259227,104
MATH 104B,Numerical Analysis,Mathematics - MATH,letters_and_science,Math 104A with a minimum grade of C.,1915,978,0.5107049608355091,104
MATH 108A,Linear Algebra,Mathematics - MATH,letters_and_science,"Mathematics 3C or 3CI or 4A or 4AI, 4B or 4BI or 5A or 5AI; and Math 8 with a grade of ""C"" or better.",4075,1418,0.34797546012269936,108
MATH CS 108A,Advanced Linear Algebra I,Mathematics (Creative Studies) - MATH CS,creative_studies,None,152,152,1,108
MATH 108B,Linear Algebra,Mathematics - MATH,letters_and_science,Math 108A with a minimum grade of C.,2352,742,0.31547619047619047,108
MATH 111B,Abstract Algebra,Mathematics - MATH,letters_and_science,Math 111A with a minimum grade of C.,599,264,0.44073455759599334,111
MATH 115A,Introduction to Number Theory,Mathematics - MATH,letters_and_science,"Mathematics 8 with a grade of ""C"" or better.",481,253,0.525987525987526,115
MATH 116,Combinatorial Analysis,Mathematics - MATH,letters_and_science,"Mathematics 8 with a grade of ""C"" or better.",535,220,0.411214953271028,116
MATH 117,Methods of Analysis,Mathematics - MATH,letters_and_science,"Mathematics 8 with a grade of ""C"" or better.",4543,1702,0.37464230684569666,117
MATH 118B,Real Analysis,Mathematics - MATH,letters_and_science,Math 118A and 108B with a minimum grade of C.,1127,446,0.39574090505767523,118
MATH CS 120HG,Special Topics in Mathematics - Hyperbolic Geometry,Mathematics - MATH,creative_studies,Consent of instructor.,24,24,1,120
MATH CS 120SY,Special Topics in Mathematics - Symmetry,Mathematics - MATH,creative_studies,Consent of instructor.,16,16,1,120
MATH 122A,Theory of Complex Variables,Mathematics - MATH,letters_and_science,Mathematics 5A or 5AI and 5B or 5BI with a minimum grade of C; or 4B or 4BI and 6A or 6AI with a minimum grade of C; and Math 8 with a minimum grade of C.,1607,563,0.35034225264467955,122
MATH CS 122B,Complex Variables II,Mathematics - MATH,creative_studies,None,113,113,1,122
MATH 124A,Partial Differential Equations,Mathematics - MATH,letters_and_science,"Math 5A or 5AI, 5B or 5BI, and 5C with a minimum grade of C; or 4B or 4BI, 6A or 6AI, and 6B with a minimum grade of C; and Math 8 with a minimum grade of C.",1070,479,0.44766355140186914,124
MATH 132A,Optimization,Mathematics - MATH,letters_and_science,"Math 6A and Math 108A, both with a grade of C or above. Computer Science 8 or 16, or Engineering 3 with a minimum grade of C.",368,152,0.41304347826086957,132
MATH 193,Internship in Mathematics,Mathematics - MATH,letters_and_science,Consent of instructor and department.,3,3,1,193
MATH 197A,Senior Thesis,Mathematics - MATH,letters_and_science,Open to senior majors only; consent of department and instructor.,26,24,0.9230769230769231,197
MATH 197B,Senior Thesis,Mathematics - MATH,letters_and_science,Mathematics 197A. Open to senior majors only; consent of department and instructor.,16,15,0.9375,197
MATH 199,Independent Studies in Mathematics,Mathematics - MATH,letters_and_science,Upper-division standing; completion of 2 upper-division courses in math; consent of instructor and department.,51,39,0.7647058823529411,199
MATH 199RA,Independent Research Assistance,Mathematics - MATH,letters_and_science,Upper-division standing; completion of 2 upper-division courses in math; consent of instructor and department.,2,2,1,199
ME 6,Basic Electrical and Electronic Circuits,Mechanical Engineering - ME,engineering,Physics 3-3L; Mathematics 4A or 4AI or 3C; open to ME majors only.,984,459,0.46646341463414637,6
ME 12S,Introduction to Machine Shop,Mechanical Engineering - ME,engineering,Mechanical engineering majors only.,1436,1299,0.9045961002785515,12
ME 15,Strength of Materials,Mechanical Engineering - ME,engineering,ME 14 with a minimum grade of C-; open to mechanical engineering majors only.,1160,607,0.5232758620689655,15
ME 95,Introduction to Mechanical Engineering,Mechanical Engineering - ME,engineering,Consent of instructor.,4,4,1,95
ME 97,Mechanical Engineering Design Projects,Mechanical Engineering - ME,engineering,Consent of instructor.,13,13,1,97
ME 99,Introduction to Research,Mechanical Engineering - ME,engineering,Consent of instructor.,1,1,1,99
ME 108,Applications of Finite Element Analysis,Mechanical Engineering - ME,engineering,ME 14; ME 15,19,19,1,108
ME 112,Energy,Mechanical Engineering - ME,engineering,Senior Undergraduate or Graduate Student status in the College of Engineering; or consent of Instructor,113,42,0.37168141592920356,112
ME 125ED,Special Topics in ME:Bio-Inspired Design in Fluid Mechanics,Mechanical Engineering - ME,engineering,Consent of instructor.,42,39,0.9285714285714286,125
ME 125EH,Special Topics in Soft Robotics,Mechanical Engineering - ME,engineering,Consent of instructor.,66,66,1,125
ME 125ES,Special Topics in ME: Energy Storage Technologies,Mechanical Engineering - ME,engineering,Consent of instructor.,19,18,0.9473684210526315,125
ME 125FA,Special Topics:Failure Analysis,Mechanical Engineering - ME,engineering,Consent of instructor.,75,41,0.5466666666666666,125
ME 125KF,Special Topics in ME:Design and Construction of Scientific Apparatus,Mechanical Engineering - ME,engineering,Consent of instructor.,34,20,0.5882352941176471,125
ME 125LP,Special Topics in Mechanical Engineering: Intro to Design Optimization,Mechanical Engineering - ME,engineering,Consent of instructor.,386,254,0.6580310880829016,125
ME 125ML,Special Topics in ME: Research Topics in Machine Learning and System Identification,Mechanical Engineering - ME,engineering,Consent of instructor.,52,47,0.9038461538461539,125
ME 125YZ,Special Topics in Mechanical Engineering: Introduction to interfacial phenomena,Mechanical Engineering - ME,engineering,Consent of instructor.,36,36,1,125
ME 127,Introduction to Mechanisms,Mechanical Engineering - ME,engineering,Upper-division standing. ME 16 or consent of the instructor.,13,10,0.7692307692307693,127
ME 141A,Introduction to Nanoelectromechanical and Microelectromechanical systems (NEMS/MEMS),Mechanical Engineering - ME,engineering,ME 16 & 17; ME 152A & ME 151A (may be concurrent); or ECE 130A & 137A with a minimum grade of C- in both.,183,106,0.5792349726775956,141
ME 151B,Thermosciences 2,Mechanical Engineering - ME,engineering,ME 151A and 152A.,1070,402,0.37570093457943926,151
ME 152B,Fluid Mechanics,Mechanical Engineering - ME,engineering,ME 152A. Open to ME majors only.,1039,468,0.4504331087584216,152
ME 156B,Mechanical Engineering Design-II,Mechanical Engineering - ME,engineering,ME 156A. Open to ME majors only.,1068,408,0.38202247191011235,156
ME 158,Computer Aided Design and Manufacturing,Mechanical Engineering - ME,engineering,ME 10 and ME 156A; open to ME majors only.,313,271,0.865814696485623,158
ME 163,Engineering Mechanics:Vibrations,Mechanical Engineering - ME,engineering,ME 16 with a minimum grade of C-; open to ME majors only.,1058,394,0.3724007561436673,163
ME 179P,Introduction to Robotics: Planning and Kinematics,Mechanical Engineering - ME,engineering,Engr 3; and either ME 17 or ECE 130C (may be taken concurrently). Not open for credit to students who have completed ME 170A or ECE 181A.,156,79,0.5064102564102564,179
ME 186A,Manufacturing and Materials,Mechanical Engineering - ME,engineering,ME 151C; and ME 15; and Materials 101 or Materials 100C,9,2,0.2222222222222222,186
ME 189B,Capstone Mechanical Engineering Design Project,Mechanical Engineering - ME,engineering,ME 189A,902,643,0.7128603104212861,189
ME 193,Internship in Industry,Mechanical Engineering - ME,engineering,Consent of instructor. Prior departmental approval needed.,3,3,1,193
ME 197,Independent Projects in Mechanical Engineering Design,Mechanical Engineering - ME,engineering,ME 16; consent of instructor.,179,171,0.9553072625698324,197
ME 199,Independent Studies in Mechanical Engineering,Mechanical Engineering - ME,engineering,Consent of instructor; upper-division standing; completion of two upper-division courses in Mechanical Engineering.,62,60,0.967741935483871,199
MAT 80EM,Mediated Worlds/THEMAS Engineering+Mathematics Emphasis,Media Arts and Technology - MAT,letters_and_science,"",134,68,0.5074626865671642,80
ME ST 199,Independent Studies in Medieval Studies,Medieval Studies - ME ST,letters_and_science,Upper-division standing; completion of at least two upper-division courses in medieval studies.,4,4,1,199
MS 1AB,Basic Military Policies and Organizations,Military Science - MS,letters_and_science,none,218,211,0.9678899082568807,1
MS 22,Basic Military Physical Conditioning,Military Science - MS,letters_and_science,"",1309,1230,0.9396485867074102,22
MS 99,Independent Studies,Military Science - MS,letters_and_science,Consent of instuctor and department.,377,371,0.9840848806366048,99
MS 132,Tactical Leadership II,Military Science - MS,letters_and_science,Military Science 131; junior standing.,182,179,0.9835164835164835,132
MS 142,Developmental Leadership II,Military Science - MS,letters_and_science,Military Science 141; senior standing.,157,148,0.9426751592356688,142
MS 190,Advanced Military Science Field Study,Military Science - MS,letters_and_science,"Students must have had successfully completed MS 131, 132, and MS 133, and three quarters of MS 22 prior to attending this course. Students must meet US Army Officer contracted Qualification and Documentation Requirements.",68,68,1,190
MS 199,Independent Studies,Military Science - MS,letters_and_science,Upper-division standing; completion of at least two upper-division courses in military science; open only to ROTC advanced students approved by the department chair.,501,491,0.9800399201596807,199
MCDB 1B,Introductory Biology II--Physiology,"Molecular, Cellular & Develop. Biology - MCDB",letters_and_science,MCDB 1A and Chemistry 1A-B-C with a grade of C- or better; or MCDB 1A with a grade of C or better.,32456,6475,0.19950086270643333,1
MCDB 1BZ,Selected Topics from MCDB 1B,"Molecular, Cellular & Develop. Biology - MCDB",letters_and_science,Consent of department.,75,51,0.68,1
MCDB 1LL,Introductory Biology Laboratory I,"Molecular, Cellular & Develop. Biology - MCDB",letters_and_science,MCDB 1A (may be taken concurrently).,11203,9680,0.8640542711773632,1
MCDB 12,Biology Mentoring and Engagement II,"Molecular, Cellular & Develop. Biology - MCDB",letters_and_science,Concurrent enrollment in Chemistry 1B or 2B.,1324,1317,0.9947129909365559,12
MCDB 15NG,Sensory Neuroscience at the Dining Table,"Molecular, Cellular & Develop. Biology - MCDB",letters_and_science,Freshmen/1st year Prebiology majors only.,63,63,1,15
MCDB 20,Concepts of Biology,"Molecular, Cellular & Develop. Biology - MCDB",letters_and_science,"",1520,311,0.20460526315789473,20
MCDB 28,Human Genetics and Society,"Molecular, Cellular & Develop. Biology - MCDB",letters_and_science,"",187,156,0.8342245989304813,28
MCDB 84,Internship in Biological Sciences,"Molecular, Cellular & Develop. Biology - MCDB",letters_and_science,Lower-division standing; instructor and departmental approval required.,6,6,1,84
MCDB 98,Readings in Biology,"Molecular, Cellular & Develop. Biology - MCDB",letters_and_science,Consent of instructor and department.,6,6,1,98
MCDB 99,Introduction to Research,"Molecular, Cellular & Develop. Biology - MCDB",letters_and_science,Consent of instructor and department.,127,126,0.9921259842519685,99
